{
  "$schema": "https://raw.githubusercontent.com/DameurMounir/transformation-portfolio-contracts/v1.0.0/schemas/stages/requirements-assessment.v1.schema.json",
  "spec_version": "1.0.0",
  "digest_profile": "TPC-JCS-SHA256-v1",
  "artifact_type": "RequirementsAssessment",
  "artifact_id": "RQA-ATLASBRIDGE-001",
  "transformation_id": "ATLASBRIDGE-ONBOARDING-TRANSFORMATION-001",
  "case_id": "ATLASBRIDGE-ONBOARDING-001",
  "stage": "REQUIREMENTS_QUALITY",
  "status": "HUMAN_CONFIRMED",
  "produced_at": "2026-08-08T12:00:00Z",
  "producer": {
    "repository": "DameurMounir/requirements-quality-agent",
    "source_uri": "https://github.com/DameurMounir/requirements-quality-agent",
    "release": "v0.2.0",
    "commit_sha": "1111111111111111111111111111111111111111",
    "tree_sha": "1111111111111111111111111111111111111112",
    "tool_version": "0.2.0"
  },
  "inputs": [],
  "authority": {
    "decision_id": "RQA-REVIEW-ATLASBRIDGE-001",
    "actor_id": "MOUNIR",
    "role": "REQUIREMENTS_REVIEWER",
    "authority_scope": "REQUIREMENTS_BASELINE_REVIEW",
    "action": "CONFIRM",
    "outcome": "APPROVED",
    "rationale": "The two requirements are evidence-backed and buildable.",
    "conditions": [],
    "artifact_digest": "7dbe6d625721f3905ed7c1b1c02f0ba55ba560910fe4b2adfccfaebda60e408e",
    "recorded_at": "2026-08-08T11:55:00Z",
    "review_round": 1
  },
  "payload_sha256": "e0a4fd8c58b83f4dc07de01105afe2b151cb7930fa275139f5c5a931233cf858",
  "artifact_sha256": "c6fd82bba85027aa8948bdd0b1b21086c368e123be7053f662986093da1c064e",
  "chain_sha256": "80a70e114742b5729bdb2bda106732cca041a45b08ab1e5675fe022e53775988",
  "payload": {
    "requirements_baseline_id": "ATLASBRIDGE-REQ-001",
    "source_pack_sha256": "9c400a5aa7429186905d0101694e60449aa1025aca8eba13287e9aeb4b85831d",
    "requirements": [
      {
        "requirement_id": "ATLASBRIDGE-REQ-IDENTITY-001",
        "statement": "Identity evidence must be verified before an onboarding case can be approved.",
        "status": "CONFIRMED",
        "priority": "MUST",
        "evidence_refs": [
          {
            "evidence_id": "EVID-REQ-IDENTITY-001",
            "source_artifact_id": "ATLASBRIDGE-REQ-SOURCE-001",
            "source_id": "requirements/atlasbridge.md",
            "source_path": "requirements/atlasbridge.md",
            "source_sha256": "9c400a5aa7429186905d0101694e60449aa1025aca8eba13287e9aeb4b85831d",
            "exact_quote": "Identity evidence must be verified before an onboarding case can be approved.",
            "quote_sha256": "9c400a5aa7429186905d0101694e60449aa1025aca8eba13287e9aeb4b85831d",
            "location": {
              "start_line": 1,
              "end_line": 1
            },
            "evidence_verdict": "SUPPORTS"
          }
        ]
      },
      {
        "requirement_id": "ATLASBRIDGE-REQ-TRAINING-001",
        "statement": "Support training is mandatory before the new onboarding process enters production.",
        "status": "CONFIRMED",
        "priority": "MUST",
        "evidence_refs": [
          {
            "evidence_id": "EVID-REQ-TRAINING-001",
            "source_artifact_id": "ATLASBRIDGE-REQ-SOURCE-002",
            "source_id": "requirements/training.md",
            "source_path": "requirements/training.md",
            "source_sha256": "ca596a328e01160144472f38317f64b46787478412e59dd7484198b100713a12",
            "exact_quote": "Support training is mandatory before the new onboarding process enters production.",
            "quote_sha256": "ca596a328e01160144472f38317f64b46787478412e59dd7484198b100713a12",
            "location": {
              "start_line": 1,
              "end_line": 1
            },
            "evidence_verdict": "SUPPORTS"
          }
        ]
      }
    ],
    "findings": [],
    "open_clarification_questions": [],
    "approved_revisions": [],
    "critical_unresolved_count": 0,
    "scorecard": {
      "total_requirements": 2,
      "confirmed": 2,
      "unresolved": 0,
      "rejected": 0,
      "quality_score_basis_points": 10000
    },
    "analysis_provenance": {
      "analysis_method": "requirements-quality-agent deterministic ruleset",
      "rulebook_sha256": "ca596a328e01160144472f38317f64b46787478412e59dd7484198b100713a12",
      "analysis_sha256": "9c400a5aa7429186905d0101694e60449aa1025aca8eba13287e9aeb4b85831d"
    },
    "human_review": {
      "decision_id": "RQA-REVIEW-ATLASBRIDGE-001",
      "actor_id": "MOUNIR",
      "role": "REQUIREMENTS_REVIEWER",
      "authority_scope": "REQUIREMENTS_BASELINE_REVIEW",
      "action": "CONFIRM",
      "outcome": "APPROVED",
      "rationale": "The two requirements are evidence-backed and buildable.",
      "conditions": [],
      "artifact_digest": "7dbe6d625721f3905ed7c1b1c02f0ba55ba560910fe4b2adfccfaebda60e408e",
      "recorded_at": "2026-08-08T11:55:00Z",
      "review_round": 1
    }
  },
  "limitations": [
    "Synthetic AtlasBridge case; producer commit and tree identifiers are demonstrative.",
    "This assessment does not authorize implementation or release."
  ]
}
